<?xml version="1.0" encoding="UTF-8" ?>
<Programacion xmlns:xsi="http://www.w3.org/2001/XMLSchema-instance"
          xsi:noNamespaceSchemaLocation="ejercicio.xsd">
    <Lenguaje>
        <Nombre>Python</Nombre>
        <Creador>Guido van Rossum</Creador>
        <AnioCreacion>1991</AnioCreacion>
        <Descripcion>Python is a high-level, interpreted, and general-purpose
        programming language that emphasizes readability with its notable use of
        significant whitespace.</Descripcion>
    </Lenguaje>
    <Lenguaje>
        <Nombre>Java</Nombre>
        <Creador>James Gosling</Creador>
        <AnioCreacion>1995</AnioCreacion>
        <Descripcion>Java is a class-based, object-oriented programming language
        that is designed to hace as few implementation dependencies as possible.</Descripcion>
    </Lenguaje>
    <Lenguaje>
        <Nombre>C++</Nombre>
        <Creador>Bjarne Stroustrup</Creador>
        <AnioCreacion>1985</AnioCreacion>
        <Descripcion>C++ is a general-purpose programming language
        created as an extension of the C programming language, or "C with Classes"</Descripcion>
    </Lenguaje>
</Programacion>